{
  "fixture": true,
  "projectionIdentity": "work:JW-RISK-028",
  "projectionVersion": "2026-08-27T02:20:00Z#18",
  "eventCursor": "evt-000018",
  "generatedAt": "2026-08-27T10:42:00Z",
  "label": "仅用于 P1 前端交互验证的 fixture，非真实后端、客户或 V1 数据。",
  "scenarios": ["风控业务协同", "需求开发协同", "人机交互协同", "内容生产协同", "经营增长协同", "物理智能协同", "知识办公协同", "客户服务协同", "供应链履约协同", "医疗服务协同"],
  "defaultViews": {"风控业务协同":"progress","需求开发协同":"progress","人机交互协同":"relation","内容生产协同":"progress","经营增长协同":"matrix","物理智能协同":"relation","知识办公协同":"progress","客户服务协同":"progress","供应链履约协同":"matrix","医疗服务协同":"progress"},
  "work": {"id":"JW-RISK-028","title":"供应商准入材料复核","goal":"在不扩大授权范围的前提下，完成材料核验并形成可追溯的准入建议。","goalVersion":"v3","stage":"人工 Gate","status":"等待具名决定","owner":{"id":"human-chen","name":"陈审查员","role":"风险责任人","authority":"approve"},"nextStep":"由陈审查员审阅补证范围并选择“要求补证”或“进入 Gate”。"},
  "actors": [
    {"id":"human-chen","name":"陈审查员","type":"human","role":"风险责任人","authority":"approve","state":"当前 owner"},
    {"id":"agent-evidence","name":"证据 Agent","type":"agent","role":"材料整理","authority":"none","state":"已完成整理"},
    {"id":"agent-review","name":"复核 Agent","type":"agent","role":"冲突复核","authority":"none","state":"发现 1 项 Challenge"},
    {"id":"system-registry","name":"准入登记系统","type":"system","role":"外部登记","authority":"receipt-only","state":"等待 ActionIntent"}
  ],
  "stages": [
    {"id":"intake","name":"目标接受","state":"done","detail":"GoalVersion v3 已由 owner 接受"},
    {"id":"evidence","name":"证据整理","state":"done","detail":"3 条引用，1 条缺口"},
    {"id":"review","name":"交叉复核","state":"done","detail":"Challenge 已提出"},
    {"id":"gate","name":"人工 Gate","state":"current","detail":"需要具名决定"},
    {"id":"action","name":"外部登记","state":"pending","detail":"尚未生成 ActionIntent"}
  ],
  "matrix": {"columns":["目标接受","证据整理","交叉复核","人工 Gate","外部登记"],"rows":[
    {"actorId":"human-chen","cells":["owner / 已确认","知悉 / 已读","review / 已读","approve / 待处理","authorize / 未开始"]},
    {"actorId":"agent-evidence","cells":["assist / 已完成","prepare / 已完成","context / 只读","none / 无权","none / 无权"]},
    {"actorId":"agent-review","cells":["assist / 已完成","review / 已完成","challenge / 已提出","none / 无权","none / 无权"]},
    {"actorId":"system-registry","cells":["none / —","none / —","none / —","policy / 等待","receipt-only / 未知"]}
  ]},
  "activities": [
    {"id":"a08","type":"system","time":"10:42","title":"Projection 已重建","body":"身份、版本与游标已对齐；当前为 fixture。","scope":"global"},
    {"id":"a07","type":"message","time":"10:39","title":"陈审查员","body":"请把缺失材料的适用范围单独列出。","scope":"human-chen"},
    {"id":"a06","type":"artifact","time":"10:36","title":"准入材料摘要 v2","body":"引用 3 条 Evidence；保留来源与采集时间。","scope":"agent-evidence"},
    {"id":"a05","type":"challenge","time":"10:34","title":"来源适用范围冲突","body":"证据 E-12 与供应范围不一致；需要人工判断。","scope":"agent-review"},
    {"id":"a04","type":"handoff","time":"10:30","title":"复核 Agent → 陈审查员","body":"交接 Challenge 与引用，不转移最终责任。","scope":"human-chen"},
    {"id":"a03","type":"gate","time":"10:27","title":"人工 Gate 待处理","body":"具名责任人：陈审查员；Agent authority=none。","basis":"依据：Evidence E-12 与供应范围说明 v3","impact":"影响：未通过则不创建外部登记 ActionIntent。","scope":"human-chen","authoritative":true},
    {"id":"a02","type":"action","time":"10:24","title":"ActionIntent 未生成","body":"外部登记需通过 Gate 后才可创建。","scope":"system-registry","authoritative":true},
    {"id":"a01","type":"receipt","time":"10:24","title":"Receipt：unknown","body":"没有外部执行事实；不得视为已登记。","receiptStatus":"unknown","scope":"system-registry","authoritative":true}
  ]
}
